{
  "schema_version": "0.1.0",
  "record_type": "EvaluationResult",
  "document_status": "draft",
  "payload": {
    "evaluation_id": null,
    "request_ref": null,
    "configuration_ref": null,
    "targets": null,
    "execution_status": null,
    "metrics": null,
    "findings": null,
    "artifacts": null,
    "acceptance": null,
    "limitations": null
  },
  "unresolved_items": [
    {
      "field": "/payload",
      "reason": "尚未填写并核对本对象所需信息。",
      "affected_actions": [
        "字段定稿；不授予计算许可"
      ],
      "question": "请填写有来源的信息；未知字段保持待确认，不填默认值，不据空标签推断纯背景。"
    }
  ]
}
